{
  "source": "https://database.lichess.org/broadcast/lichess_db_broadcast_2025-02-03-04.pgn.zst",
  "retrieved_at": "2026-05-24T22:30:37Z",
  "label": "clean",
  "label_confidence": "high",
  "notes": "OTB broadcast game (TCEC Season 27 - FRD 3 League D) \u2014 arbiter-monitored at play time. Source: Lichess broadcast archive lichess_db_broadcast_2025-02-03-04 (CC-BY-SA 4.0). Players: Altair 7.1.5-e489e46e vs Velvet 8.1.0."
}
