{
  "source": "https://database.lichess.org/broadcast/lichess_db_broadcast_2025-02-03-04.pgn.zst",
  "retrieved_at": "2026-05-24T22:30:24Z",
  "label": "clean",
  "label_confidence": "high",
  "notes": "OTB broadcast game (Round 6: Montilla Rodriguez, Camilo - Tapiero Lozano, Harrison Geronimo) \u2014 arbiter-monitored at play time. Source: Lichess broadcast archive lichess_db_broadcast_2025-02-03-04 (CC-BY-SA 4.0). Players: Montilla Rodriguez, Camilo vs Tapiero Lozano, Harrison Geronimo."
}
