{
  "source": "https://database.lichess.org/broadcast/lichess_db_broadcast_2025-02-03-04.pgn.zst",
  "retrieved_at": "2026-05-24T22:30:35Z",
  "label": "clean",
  "label_confidence": "high",
  "notes": "OTB broadcast game (Quarter-Finals | Tiebreak: Ahmadzada, Ahmad - Mamedov, Rauf) \u2014 arbiter-monitored at play time. Source: Lichess broadcast archive lichess_db_broadcast_2025-02-03-04 (CC-BY-SA 4.0). Players: Ahmadzada, Ahmad vs Mamedov, Rauf."
}
