{
  "source": "https://database.lichess.org/broadcast/lichess_db_broadcast_2025-02-03-04.pgn.zst",
  "retrieved_at": "2026-05-24T22:30:28Z",
  "label": "clean",
  "label_confidence": "high",
  "notes": "OTB broadcast game (Ronda 3: Corrales Corrales, Ana Maria - Arguedas Bolanos, Sharline) \u2014 arbiter-monitored at play time. Source: Lichess broadcast archive lichess_db_broadcast_2025-02-03-04 (CC-BY-SA 4.0). Players: Corrales Corrales, Ana Maria vs Arguedas Bolanos, Sharline."
}
